{
  "sensor_type": "light_level",
  "unit": "lux",
  "universe_of_discourse": { "min": 0.0, "max": 100000.0 },
  "confidence_threshold": 0.1,
  "linguistic_variables": [
    {
      "term": "dark",
      "function_type": "trapezoidal",
      "parameters": { "a": 0.0, "b": 0.0, "c": 50.0, "d": 150.0 }
    },
    {
      "term": "dim",
      "function_type": "triangular",
      "parameters": { "a": 100.0, "b": 300.0, "c": 500.0 }
    },
    {
      "term": "moderate",
      "function_type": "triangular",
      "parameters": { "a": 400.0, "b": 750.0, "c": 2000.0 }
    },
    {
      "term": "bright",
      "function_type": "triangular",
      "parameters": { "a": 1500.0, "b": 5000.0, "c": 20000.0 }
    },
    {
      "term": "very_bright",
      "function_type": "trapezoidal",
      "parameters": { "a": 15000.0, "b": 30000.0, "c": 100000.0, "d": 100000.0 }
    }
  ]
}
